listing_id,name,city,neighborhood,room_type,accommodates,property_type,price,review_scores_rating
680519123710389248,Sunny corner w/ open floor plan,Portland,Piedmont,Entire home/apt,4,Entire rental unit,93.0,5.0
1268201952297658624,Luxury downtown condo in the pearl,Portland,Pearl,Entire home/apt,4,Entire rental unit,110.0,5.0
40122072,Charming home in safe beautiful area - fenced yard,Portland,Northwest Heights,Entire home/apt,9,Entire home,300.0,5.0
23609556,Bright House-share with Private Bath Near Airport,Portland,Roseway,Private room,4,Private room in home,90.0,5.0
984287915670628608,Play&Work in Southwest Portland,Portland,South Portland,Entire home/apt,4,Entire home,999.0,5.0
4648534,The perfect spot!,Portland,Sellwood-Moreland Improvement League,Entire home/apt,2,Entire guesthouse,80.0,5.0
625918158290441728,"Huge, Bright & Modern 5 Bdrm w/Fenced Yard",Portland,Mt. Tabor,Entire home/apt,9,Entire home,209.0,5.0
1232866371654620416,Walkable in hipster SE Portland,Portland,Richmond,Entire home/apt,5,Entire rental unit,122.0,5.0
21425869,"“Pearl Pad” Grt. location, view & free EV Chging!",Portland,Pearl,Entire home/apt,3,Entire condo,150.0,5.0
1248731865719201536,Desert Vibe 1BR in SE PDX - Local Bars & Food,Portland,Buckman,Entire home/apt,2,Entire home,81.0,5.0
987058114053477120,PDX Urban Garden Apartment,Portland,Reed,Entire home/apt,2,Entire rental unit,90.0,5.0
881189619149329664,Maplewood Retreat,Portland,Maplewood,Entire home/apt,4,Entire home,158.0,5.0
1091413309953163776,Best Neighborhood in Town! #9,Portland,Northwest District,Entire home/apt,2,Entire rental unit,55.0,5.0
1074271375122820992,Natural setting Relax & Recharge,Portland,Multnomah,Private room,1,Private room in home,48.0,5.0
1238819120342037504,Skyline Sanctuary,Portland,Northwest Heights,Entire home/apt,5,Entire rental unit,135.0,5.0
626068463862576640,"Charm, Space and Comfort near Multnomah Village",Portland,Multnomah,Entire home/apt,4,Entire guest suite,90.0,5.0
46715181,Alberta Arts Bungalow for Longer Stays (31+ days),Portland,Sabin,Entire home/apt,4,Entire bungalow,90.0,5.0
697115,Classic Bedroom/Private Vanity,Portland,Hillsdale,Private room,1,Private room in home,56.0,5.0
23546465,Private ensuite queen bedroom/bath in St Johns.,Portland,St. Johns,Private room,1,Private room in home,60.0,5.0
563223799929727680,Cozy Vintage Pub Theme 1 bd w/ private entrance,Portland,Lents,Entire home/apt,2,Entire place,57.0,5.0
1271164597124512768,Cully Neighborhood Backyard Birdhouse,Portland,Cully,Entire home/apt,2,Entire guesthouse,64.0,5.0
27555604,Cascadia: Our reviews say it all!,Portland,Piedmont,Entire home/apt,4,Entire home,81.0,5.0
18379258,Historic Jacobberger House  Downtown Portland,Portland,Southwest Hills,Entire home/apt,4,Entire home,483.0,5.0
9200540,NEW:3 level twnhse 3 Bdr-3.5  bth by OHSU/River,Portland,South Portland,Entire home/apt,3,Entire townhouse,128.0,5.0
908743277651383168,Modern ADU near Penninsula Park,Portland,Woodlawn,Entire home/apt,4,Entire rental unit,59.0,5.0
892315206523159424,large room in downtown Portland,Portland,Portland Downtown,Private room,2,Private room in rental unit,65.0,5.0
824712137951653376,Charming 3bed Home w/ Yard - Walk Score 91!,Portland,King,Entire home/apt,8,Entire home,99.0,5.0
49196317,The Highland Rose Retreat Awaits You and Yours,Portland,Sylvan-Highlands,Entire home/apt,4,Entire guest suite,123.0,5.0
1196041329273472000,Roof Deck & Food Pods -Hawthorne Penthouse Retreat,Portland,Buckman,Entire home/apt,4,Entire rental unit,157.0,5.0
1641774,Walk to OHSU/15-min drive to Intel. Pristine Room!,Portland,Hillsdale,Private room,2,Private room in home,60.0,5.0
1293106783608757504,Charming & Cozy Retreat in Portland,Portland,Hayhurst,Private room,2,Private room in home,54.0,5.0
1294599934484989696,Brand New Westmoreland Contemporary,Portland,Sellwood-Moreland Improvement League,Entire home/apt,4,Entire home,188.0,5.0
52551684,Elegant Historic Irvington Home,Portland,Irvington,Entire home/apt,5,Entire home,182.0,5.0
1268128745638786560,Location+ Patio + Charm,Portland,Rose City Park,Entire home/apt,2,Entire rental unit,67.0,5.0
1029398723212833536,Furnished 1 BR unit near OHSU Dog Friendly (04D),Portland,Homestead,Entire home/apt,2,Entire rental unit,110.0,5.0
1047542319928861824,Bright Spacious Elliot Cottage,Portland,Eliot,Entire home/apt,2,Entire home,100.0,5.0
1297986691151847168,Tiny Refuge ~ Quiet & Cozy,Portland,Richmond,Entire home/apt,2,Entire home,67.0,5.0
881431276327906560,Modern condo in North Tabor,Portland,North Tabor,Entire home/apt,3,Entire home,110.0,5.0
1214736561082716672,Renovated Historic Nob Hill Beauty ~ 94 WalkScore,Portland,Northwest District,Entire home/apt,6,Entire home,127.0,5.0
653893942563566720,Modern Mid Century Duplex  Woodstock/Reed College,Portland,Woodstock,Entire home/apt,4,Entire home,93.0,5.0
1016059367607163648,Chic Retreat in the Pearl,Portland,Pearl,Entire home/apt,2,Entire townhouse,128.0,5.0
47757886,B House NW PDX Hillside w/sauna & Mt Hood view,Portland,Hillside,Entire home/apt,2,Entire cottage,118.0,5.0
53298476,Room in Stylish Mid-Century Tree House & Hot Tub!,Portland,Hillsdale,Private room,1,Private room in home,75.0,5.0
1193453571816599552,"Historic Hafner Haus B & B, Rm.1",Portland,Portland Downtown,Private room,3,Private room in bed and breakfast,79.0,5.0
1029082016777210880,"Exceptional Pet Friendly Home, Game Room w/ Pool",Portland,Bridlemile,Entire home/apt,5,Entire home,153.0,5.0
1121045393479463424,New Urban Pad N Williams Trendy Area PDX,Portland,Humboldt,Entire home/apt,2,Entire guesthouse,59.0,5.0
781710,"House near Mt Tabor, SE Portland",Portland,Montavilla,Entire home/apt,4,Entire home,100.0,5.0
1167793581368574464,Laurelhurst Dougan Suites #3,Portland,Laurelhurst,Entire home/apt,3,Entire guest suite,92.0,5.0
15500919,The Ladd - A Perfect Walkable Spot,Portland,Hosford-Abernethy,Entire home/apt,4,Entire home,135.0,5.0
838253676121376384,Tranquil guesthouse nestled high in the forest,Portland,Southwest Hills,Entire home/apt,5,Entire guesthouse,255.0,5.0
623109568187912192,Lovely and Serene 2 Bedroom Pearl District Condo,Portland,Pearl,Entire home/apt,4,Entire condo,150.0,5.0
1015187564134109184,Charming Portland Hideaway-Woodstock Neighborhood,Portland,Woodstock,Entire home/apt,3,Entire guest suite,76.0,5.0
1231923519949126400,Cozy North Tabor Farmhouse ~ Gym + Chefs Kitchen,Portland,North Tabor,Entire home/apt,4,Entire home,147.0,5.0
1196031016876098816,Fresh Farmhouse Remodel in SE Portland 96BikeScore,Portland,Hosford-Abernethy,Entire home/apt,4,Entire home,150.0,5.0
855692533793103744,Hawthorne Schoolhouse,Portland,Richmond,Entire home/apt,2,Tiny home,90.0,5.0
977855333525415680,"Rustic home in Multnomah village, Portland",Portland,Multnomah,Entire home/apt,2,Entire home,100.0,5.0
889347365329464704,N Portland Adventure Basecamp!,Portland,Kenton,Private room,2,Private room in home,55.0,5.0
35155827,Large contemporary in a historic train station,Portland,Pearl,Entire home/apt,6,Entire townhouse,200.0,5.0
1219600878630087936,Classic 1920s Alberta Home + 2 Tiny Homes,Portland,Concordia,Entire home/apt,12,Entire home,556.0,5.0
1091480877668432896,Beautiful Newly Renovated House,Portland,Powellhurst-Gilbert,Entire home/apt,2,Entire home,229.0,5.0
860215050264200448,The Grand King at Hotel Grand Stark,Portland,Buckman,Entire home/apt,2,Entire serviced apartment,0.0,5.0
948561801955100032,"Peaceful 2BR with incredible view, deck & firepit",Portland,West Portland Park,Entire home/apt,5,Entire home,219.0,5.0
9905408,Nan''s North Portland Crepe Myrtle Cottage,Portland,Boise,Entire home/apt,2,Entire home,65.0,5.0
1297981551097542912,"Luxury Hawthorne Gem! 99 Walk Score, New Remodel",Portland,Richmond,Entire home/apt,4,Entire home,99.0,5.0
635413907290834944,"Astroranchpdx  7acres, 20 min from central PDX",Portland,Pleasant Valley,Entire home/apt,16,Ranch,225.0,5.0
1071815118810967808,Bright Recently Upgraded Apt – Free Parking!,Portland,Pearl,Entire home/apt,4,Entire rental unit,135.0,5.0
16017785,2 bedrooms plus office in vibrant Buckman,Portland,Buckman,Entire home/apt,3,Entire home,95.0,5.0
929266002843301888,Private room and Bath in downtown Portland,Portland,Portland Downtown,Private room,2,Private room in rental unit,60.0,5.0
31717654,Industrial Pearl District Loft - Free Parking,Portland,Pearl,Entire home/apt,2,Entire condo,113.0,5.0
886952564101591040,"Sunstone House, Sunny, Desk, Safe, transit/dining",Portland,Kenton,Private room,2,Private room in townhouse,34.0,5.0
42619371,"Comfortable room, desk & FireTV - Monthly discount",Portland,St. Johns,Private room,1,Private room in home,45.0,5.0
592914094507369984,The Nest: Garden Oasis in Alberta Arts w/Fireplace,Portland,Concordia,Entire home/apt,5,Entire home,201.0,5.0
1194385284964019456,"Alberta Arts Luxury, Sleeps 4, Walk Score 99",Portland,Vernon,Entire home/apt,4,Entire home,126.0,5.0
1127010490662298624,Budget friendly studio Location!,Portland,Pearl,Entire home/apt,2,Entire rental unit,52.0,5.0
1113131483672875392,Unbeatable location in heart of NW Alphabet,Portland,Northwest District,Entire home/apt,2,Entire condo,99.0,5.0
1021714725123193600,The Portland Dome: Glamping in the City,Portland,South Tabor,Entire home/apt,2,Dome,63.0,5.0
36200612,"Hotel Rose, Bridgetown King",Portland,Portland Downtown,Private room,2,Room in boutique hotel,0.0,5.0
19049489,The Crow;s Nest @ The Gilman,Portland,Kerns,Private room,2,Private room in home,182.0,5.0
1156182653769621504,"Casita Studio, W/D & Workspace",Portland,Piedmont,Entire home/apt,4,Entire guesthouse,101.0,5.0
1011887443911257472,3 Bedroom 1892 Historic Landmark and Secret Garden,Portland,Hosford-Abernethy,Entire home/apt,6,Entire home,212.0,5.0
1222477338564932096,"Historic Hafner Haus B&B, Room 3",Portland,Portland Downtown,Private room,3,Private room in bed and breakfast,69.0,5.0
44477098,"Hidden Gem 2 bed, 3 bath, office, garden, pets OK",Portland,Overlook,Entire home/apt,5,Entire home,223.0,5.0
1264120463172680192,Jerald Guesthouse,Portland,Bridlemile,Entire home/apt,4,Entire guesthouse,100.0,5.0
51015713,Urban Charmer Close to Restaurants and Shops,Portland,Northwest District,Entire home/apt,9,Entire home,180.0,5.0
948588166133141120,Urban Fern Bungalow ~ steps to shops/MAX/food!,Portland,Overlook,Entire home/apt,5,Entire home,181.0,5.0
870316809473416320,Windows Galore - Heart of Pearl!,Portland,Pearl,Entire home/apt,2,Entire rental unit,90.0,5.0
23309972,Cozy & Private Apartment in Portland''s Montavilla!,Portland,Mt. Tabor,Entire home/apt,4,Entire rental unit,98.0,5.0
755150674288332160,"Freshly renovated, swanky duplex.",Portland,Brooklyn Action Corps,Entire home/apt,4,Entire home,102.0,5.0
1263042320795955456,Luxury 2 Bed 2 Bath in Memoir Buckman Building,Portland,Buckman,Entire home/apt,4,Entire serviced apartment,253.0,5.0
47995573,Three bedroom one bath home in NE Portland,Portland,Cully,Entire home/apt,4,Entire home,99.0,5.0
1229172861084734208,Outstanding N Tabor Townhouse Compound Sleeps 16,Portland,North Tabor,Entire home/apt,16,Entire home,569.0,5.0
1196060017104280832,Scandinavian Loft ~  Local Espresso & Boutiques,Portland,Northwest District,Entire home/apt,2,Entire rental unit,132.0,5.0
1313180227235462656,Victorian in Hip Neighborhood,Portland,Boise,Entire home/apt,4,Entire rental unit,122.0,5.0
50542873,Woodstock Apartment,Portland,Woodstock,Entire home/apt,4,Entire guest suite,134.0,5.0
44325859,Room in Stylish Mid-Century Tree House + Hot Tub!,Portland,Hillsdale,Private room,1,Private room in home,75.0,5.0
1179251026643680512,Sellwood treehouse near river,Portland,Sellwood-Moreland Improvement League,Entire home/apt,4,Entire home,375.0,5.0
1298154277738180096,Modern Cozy & Private Retreat,Portland,Northwest District,Entire home/apt,5,Entire guesthouse,102.0,5.0
15042822,Historic Portland Charm with Modern Comforts,Portland,Overlook,Entire home/apt,2,Entire rental unit,0.0,5.0
41587291,Great Location!  River View,Portland,Old Town/Chinatown,Entire home/apt,2,Entire condo,150.0,5.0
1136398224149109888,D & M Homestay,Portland,St. Johns,Entire home/apt,4,Entire guesthouse,89.0,5.0
43457851,Pier Park Studio,Portland,St. Johns,Entire home/apt,1,Entire guest suite,50.0,5.0
900300707915080960,Bright Studio with Private Entry & Patio,Portland,Brooklyn Action Corps,Entire home/apt,2,Entire home,68.0,5.0
654892861520880384,Waterfront view- the best of downtown living,Portland,Portland Downtown,Entire home/apt,3,Entire condo,180.0,5.0
1061792428581317504,Osprey Suite - 205,Portland,Buckman,Private room,3,Room in boutique hotel,151.0,5.0
1144243912847040512,"Private ADU 2 Bed Suite, Private Bath, Kitchenette",Portland,Beaumont-Wilshire,Entire home/apt,4,Entire guest suite,102.0,5.0
61893,Perfect Portland Place,Portland,Goose Hollow,Entire home/apt,2,Entire condo,130.0,5.0
1162007593590697472,Terrace Studio | Executive Floor w/ Lounge Access,Portland,Portland Downtown,Private room,2,Room in boutique hotel,305.0,5.0
1233604485923195392,Modern Lux Apartment/2.5 Baths/Walkable Location!,Portland,Eliot,Entire home/apt,5,Entire rental unit,159.0,5.0
12970336,Spacious modern and private in Alberta Arts Area,Portland,Concordia,Entire home/apt,3,Entire guest suite,98.0,5.0
1060393144483495936,Cozy Apt in the Heart of SE,Portland,Richmond,Entire home/apt,2,Entire rental unit,81.0,5.0
52601863,Peaceful double bedroom with view of rear garden.,Portland,Brentwood-Darlington,Private room,1,Private room in home,45.0,5.0
50811298,"Private urban retreat, new build, 1bedroom, sleep4",Portland,Woodlawn,Entire home/apt,4,Entire guesthouse,106.0,5.0
1197933406808554240,2 Crow Ranch - Modern PDX 2BR,Portland,Arnold Creek,Entire home/apt,4,Entire home,122.0,5.0
1033547371117770752,Modern Apt Nestled in Lush Hills,Portland,Hillsdale,Entire home/apt,4,Entire home,72.0,5.0
50000480,Modern Eastside Studio close to I205,Portland,Powellhurst-Gilbert,Entire home/apt,2,Entire rental unit,72.0,5.0
854276125903354624,Modern Home with Cedar Sauna & Outdoor Patio,Portland,Cully,Entire home/apt,2,Entire bungalow,106.0,5.0
958121097873778688,Sunny in Sellwood,Portland,Sellwood-Moreland Improvement League,Entire home/apt,4,Entire home,99.0,5.0
52763423,Private Renovated Studio w full kitchen & Parking!,Portland,Far Southwest,Entire home/apt,2,Entire guest suite,105.0,5.0
1286544783939501824,Cozy Mt. Tabor Retreat,Portland,Mt. Tabor,Entire home/apt,4,Entire guest suite,135.0,5.0
926827419231695104,Modern Basement Guest Suite with Piano,Portland,Reed,Private room,2,Private room in home,62.0,5.0
1241408666649780736,1892 Bohemian Dream Studio in Ladd''s Addition,Portland,Hosford-Abernethy,Entire home/apt,2,Entire rental unit,71.0,5.0
913360251548614528,Private Room/Desk,Portland,Montavilla,Private room,1,Private room in home,33.0,5.0
1322084161526284032,Vintage Portland Home ~ Steps from Mississippi Ave,Portland,Overlook,Entire home/apt,4,Entire home,113.0,5.0
51907687,3 bedroom family friendly house in cul-de-sac.,Portland,Portsmouth,Entire home/apt,5,Entire home,95.0,5.0
873126958165084544,"Convenient Stay, Superb Location with Parking!",Portland,Portland Downtown,Hotel room,4,Room in hotel,0.0,5.0
1263888873271510272,Vintage Cozy City Condo-pets OK,Portland,Northwest District,Entire home/apt,2,Entire rental unit,125.0,5.0
1002175747617278080,Luxury in The Pearl,Portland,Pearl,Entire home/apt,2,Entire condo,110.0,5.0
1042400504348522880,"Long term, incredible Goose Hollow location",Portland,Goose Hollow,Entire home/apt,3,Entire rental unit,63.0,5.0
1238632268461810944,Peaceful and centrally located!,Portland,Buckman,Entire home/apt,2,Entire rental unit,74.0,5.0
13447534,Old World Luxury in the City.,Portland,Overlook,Entire home/apt,5,Entire home,162.0,5.0
1014857416560113024,Cozy Creekside Haven in Beautiful SW Portland,Portland,Bridlemile,Entire home/apt,4,Entire townhouse,135.0,5.0
2578371,"Sky Cabin, Modern Loft, Cozy, Clean",Portland,Humboldt,Entire home/apt,4,Entire home,85.0,5.0
29362623,Comfortable. Close to Downtown. Sleeps 4.,Portland,Hillsdale,Entire home/apt,4,Entire townhouse,110.0,5.0
50621273,Master size privet room monthly rent,Portland,Montavilla,Private room,1,Private room in guest suite,37.0,5.0
836310915166337408,Light and Bright Daylight Basement Apartment,Portland,Mill Park,Entire home/apt,4,Entire home,100.0,5.0
833521729084948992,9 Queen Beds/3.5 Baths/2 Kitchens,Portland,Irvington,Entire home/apt,10,Entire home,855.0,5.0
558105582267879232,Stylish Mid Century Duplex -Woodstock/Reed College,Portland,Woodstock,Entire home/apt,4,Entire home,79.0,5.0
873125946323534720,"Enjoy a Hassle-Free Stay, with Art Gallery!",Portland,Portland Downtown,Hotel room,4,Room in hotel,0.0,5.0
803571153281560576,"Sunstone House Sunny, desk, close dining & transit",Portland,Kenton,Private room,2,Private room in townhouse,38.0,5.0
1239453790911121408,Classic 1920s Alberta Two Bedroom Haven,Portland,Concordia,Entire home/apt,4,Entire home,128.0,5.0
712940761331432704,Lovely Quiet Neighborhood In NW/Alphabet District,Portland,Northwest District,Entire home/apt,2,Entire condo,0.0,5.0
1174471274633412864,Victorian-style home ~ very walkable ~ Unit A,Portland,Buckman,Entire home/apt,2,Entire rental unit,107.0,5.0
50956404,Finch Studio Cottage in Montavilla,Portland,Montavilla,Entire home/apt,2,Entire guesthouse,77.0,5.0
1093428881277796224,Private Studio,Portland,Kerns,Entire home/apt,2,Entire rental unit,50.0,5.0
15308248,Comfortable & convenient.,Portland,Foster-Powell,Entire home/apt,2,Entire home,60.0,5.0
620998257751566464,MODERN masterpiece in Portland! Dwell magazine,Portland,Overlook,Entire home/apt,4,Entire condo,126.0,5.0
1302343649715362816,Central Loft off Lovely Mississippi St. W/King Bd,Portland,Boise,Entire home/apt,4,Entire guesthouse,89.0,5.0
856811017433604352,Unique-Studio Apt. Across OHSU Hospital,Portland,Homestead,Entire home/apt,3,Entire rental unit,100.0,5.0
806457860498752768,"Sunstone House Wi-fi, kitchen, laundry on buslines",Portland,Kenton,Private room,1,Private room in townhouse,0.0,5.0
1100853551241099776,"High Rise Condo, Stunning Views",Portland,South Portland,Entire home/apt,2,Entire rental unit,85.0,5.0
53201487,Rare & lush 1 BR in heart of the city!,Portland,South Portland,Entire home/apt,2,Entire guest suite,59.0,5.0
1116129638519715968,Large Master Suite w/ Bath - 12'' Ceilings,Portland,Arlington Heights,Private room,2,Private room in home,65.0,5.0
962336354960084992,Spacious Corporate Haven,Portland,Portsmouth,Entire home/apt,8,Entire home,120.0,5.0
21620813,Separate spacious guest house over garage.,Portland,Hosford-Abernethy,Entire home/apt,2,Entire guesthouse,160.0,5.0
42100767,Beautiful Large MidCentury Modern Home SW Portland,Portland,Marshall Park,Entire home/apt,7,Entire home,360.0,5.0
1157460464023896064,"Couples’ Getaway: Sauna, Cold Plunge, Cozy Yurt",Portland,Arnold Creek,Entire home/apt,2,Yurt,206.0,5.0
1310213714961837312,Soak & Stay Cottage,Portland,Mill Park,Entire home/apt,6,Entire bungalow,170.0,5.0
1245054190166105344,Garage-Mahal 2 bd  w Laundry monthly lux living,Portland,Hayhurst,Entire home/apt,3,Entire guesthouse,87.0,5.0
594843688164571392,The Canopy Loft PDX,Portland,St. Johns,Entire home/apt,2,Entire guesthouse,90.0,5.0
863166598990619648,Stylish Suite! Near Portland Art Museum!,Portland,Portland Downtown,Hotel room,2,Room in hotel,0.0,5.0
12375526,"Spacious Home, HUGE Yard, 10 Mins to PDX Airport",Portland,Parkrose Heights,Entire home/apt,5,Entire home,157.0,5.0
39112551,Woodlawn Urban One Bedroom,Portland,Woodlawn,Entire home/apt,2,Entire rental unit,69.0,5.0
772044202098632064,Welcome to La Casita!,Portland,Montavilla,Entire home/apt,3,Entire guesthouse,72.0,5.0
1303725729396873472,Rustic Guesthouse in Hawthorne,Portland,Sunnyside,Entire home/apt,3,Entire guesthouse,76.0,5.0
1223978383132990720,Beautiful Alameda full ADU!,Portland,Sabin,Entire home/apt,2,Entire rental unit,75.0,5.0
1229779812569026304,Spacious Townhome Combination for the Whole Family,Portland,North Tabor,Entire home/apt,13,Entire home,531.0,5.0
44395944,"Monthly- Cozy suite -Bedroom, bath & living space",Portland,St. Johns,Private room,2,Private room in home,66.0,5.0
831127707078918656,Wyndham Portland Waterfront Park Resort | Studio,Portland,Old Town/Chinatown,Entire home/apt,2,Entire condo,134.0,5.0
50260406,Colorful Room in Craftsman Guest House,Portland,Vernon,Private room,1,Private room in home,43.0,5.0
588293421871372288,Hazelwood getaway in NE Portland #1,Portland,Hazelwood,Private room,1,Private room in home,30.0,5.0
1297640104235745792,Luxury Apartment in Central Pearl | 9,Portland,Pearl,Entire home/apt,6,Entire rental unit,250.0,5.0
1252444802539432960,Mini Dome by Dodeca Domes,Portland,Arbor Lodge,Entire home/apt,2,Tiny home,180.0,5.0
1171644337801975552,"Sunstone House  Queen, Vibrant Kenton neighborhood",Portland,Kenton,Private room,1,Private room in townhouse,38.0,5.0
1298255919482982400,The Cascadia Retreat - Luxury Home ~ 90 WalkScore,Portland,Humboldt,Entire home/apt,4,Entire rental unit,157.0,5.0
1292783906868554496,New Guest Suite in Alberta Arts Dist.,Portland,Concordia,Entire home/apt,4,Entire guest suite,68.0,5.0
12223710,"Elegant, Modern Garden House",Portland,Mt. Tabor,Entire home/apt,4,Entire home,200.0,5.0
1282254854280491776,Chez Cozy | Alberta Arts 15th Avenue Plex,Portland,Sabin,Entire home/apt,4,Entire rental unit,120.0,5.0
4054099,Modern Reed College Apartment,Portland,Reed,Entire home/apt,4,Entire rental unit,138.0,5.0
791444143388475776,The Zen - Custom Tiny Home w/ Zen Vibe,Portland,Kerns,Entire home/apt,2,Tiny home,170.0,5.0
1304381659377317120,"SE Portland, Family Friendly Home",Portland,Hazelwood,Entire home/apt,5,Entire home,122.0,5.0
958213856152157440,Gorgeous suite in huge Victorian for professionals,Portland,Buckman,Private room,2,Private room in home,43.0,5.0
807378255689177600,Modern 4B Home w/ King Bed & Spectacular Balcony,Portland,Overlook,Entire home/apt,8,Entire home,339.0,5.0
1036929634174016384,Coda Guesthouse -New in 2024,Portland,Brentwood-Darlington,Entire home/apt,4,Entire guesthouse,114.0,5.0
778265000364762880,Charming Craftsman Close to Restaurants & Shops,Portland,Northwest District,Entire home/apt,6,Entire home,172.0,5.0
956126149466173696,Spacious SE Bungalow - WFH Bliss,Portland,Foster-Powell,Entire home/apt,4,Entire home,173.0,5.0
639985681276299264,Natural light. Studio ADU + Loft. Parking on-site,Portland,Southwest Hills,Entire home/apt,3,Entire guesthouse,80.0,5.0
1291573482930896896,Cozy Getaway,Portland,Brooklyn Action Corps,Entire home/apt,4,Entire rental unit,116.0,5.0
15113378,"Views, close to OHSU and PSU.  Parking included.",Portland,Portland Downtown,Entire home/apt,4,Entire condo,85.0,5.0
984167458407555584,Ivon Street Dual Suite Rowhome,Portland,Hosford-Abernethy,Entire home/apt,4,Entire home,96.0,5.0
1203754833257046272,City Serenity: Stylish 2-Bed in heart of St. Johns,Portland,St. Johns,Entire home/apt,5,Entire rental unit,160.0,5.0
1105061881783948928,Modern 1BR Apartment - Free Parking!,Portland,Pearl,Entire home/apt,4,Entire rental unit,186.0,5.0
974257294889296128,My Little Jewel Box,Portland,Northwest District,Entire home/apt,2,Entire rental unit,75.0,5.0
1191465502742862848,The Artist''s Oasis on Alberta,Portland,Humboldt,Entire home/apt,4,Entire rental unit,157.0,5.0
35605973,Cozy Sunnyside Flat in Historic Home,Portland,Sunnyside,Entire home/apt,6,Entire rental unit,84.0,5.0
800756909716372224,Beautiful Bedroom/Bath near OHSU - Women Only,Portland,South Portland,Private room,1,Private room in townhouse,49.0,5.0
843085266516991616,Gorgeous new renovation in Alberta Arts District!,Portland,King,Entire home/apt,6,Entire home,139.0,5.0
958145188311797376,The Madrona House,Portland,Overlook,Entire home/apt,6,Entire home,138.0,5.0
834256182681884800,"Midcentury Haven, plus a doggo!",Portland,Parkrose Heights,Private room,2,Private room in home,60.0,5.0
1334928846332498944,Casa Azulita,Portland,Sumner,Private room,2,Private room in home,51.0,5.0
819022636683134592,Cozy Woodstock Bungalow,Portland,Woodstock,Entire home/apt,2,Entire home,85.0,5.0
726881571984081536,"Hillsdale Guest House, Close-In SW Portland",Portland,Bridlemile,Entire home/apt,3,Entire home,127.0,5.0
1111136208647307392,North East Portland - River View Apt!,Portland,Overlook,Entire home/apt,2,Entire rental unit,110.0,5.0
20526629,Beautiful apartment in tranquil SW,Portland,Marshall Park,Entire home/apt,2,Entire rental unit,61.0,5.0
46144002,Cute Cully Cottage,Portland,Cully,Entire home/apt,4,Entire home,220.0,5.0
15573458,Beautiful Oasis in NE Portland!,Portland,Roseway,Private room,2,Private room in home,55.0,5.0
51925459,The Redwood Shed,Portland,Arbor Lodge,Entire home/apt,3,Entire guesthouse,84.0,5.0
791444049755178496,The Boho Tiny House @Tiny Digs Hotel Bohemian Vibe,Portland,Kerns,Entire home/apt,3,Room in boutique hotel,182.0,5.0
996430199712251776,Entire house with gated yard!,Portland,Concordia,Entire home/apt,3,Entire home,88.0,5.0
1169661069606795264,The Michael,Portland,Pearl,Entire home/apt,2,Entire condo,122.0,5.0
965917701407953792,2BR Minutes Walk from OHSU! (18A),Portland,Homestead,Entire home/apt,4,Entire rental unit,92.0,5.0
729180941575654400,Long Term Architectural SW Hills 3bed 2 bath,Portland,Hillsdale,Entire home/apt,6,Entire home,350.0,5.0
50089324,"Remodeled, Quiet, Safe, Walkable, Bikable, Comfort",Portland,Rose City Park,Entire home/apt,3,Entire rental unit,110.0,5.0
50916194,Sunny one bedroom flat  with private yard,Portland,Hayhurst,Entire home/apt,3,Entire guesthouse,86.0,5.0
2349023,Cozy Williams Ave Victorian.   Walk to Everything!,Portland,Boise,Entire home/apt,5,Entire home,175.0,5.0
1063789741515155328,Creekside Sanctuary in the City,Portland,Marshall Park,Entire home/apt,6,Entire home,85.0,5.0
51575566,Urban Nature Sanctuary,Portland,East Columbia,Entire home/apt,4,Entire home,170.0,5.0
37969468,Beautiful Updated Quiet Condo with Parking Stall!,Portland,Goose Hollow,Entire home/apt,3,Entire condo,70.0,5.0
